813279758	20181231	201812	2018	2018.9890	AFG	AFGHANISTAN	AFG								AFGMIL	AFGHANISTAN	AFG					MIL			0	130	130	13	3	-4.4	1	1	1	-1.99004975124378	1	United Arab Emirates	AE	AE	24	54	AE	1	United Arab Emirates	AE	AE	24	54	AE	1	United Arab Emirates	AE	AE	24	54	AE	20181231	https://www.bignewsnetwork.com/news/258735820/trump-announcement-on-afghan-withdrawal-traded-away-leverage
813286296	20181231	201812	2018	2018.9890	ARE	ABU DHABI	ARE								ARECOP	UNITED ARAB EMIRATES	ARE					COP			1	130	130	13	3	-4.4	2	1	2	-1.96850393700787	4	Abu Dhabi, Abu Z¸aby, United Arab Emirates	AE	AE01	24.4667	54.3667	-782066	4	Abu Dhabi, Abu Z¸aby, United Arab Emirates	AE	AE01	24.4667	54.3667	-782066	4	Abu Dhabi, Abu Z¸aby, United Arab Emirates	AE	AE01	24.4667	54.3667	-782066	20181231	https://gulfnews.com/uae/weather/this-is-how-the-uae-weather-will-be-on-new-year-1.1546231222035
813286298	20181231	201812	2018	2018.9890	ARECOP	ABU DHABI	ARE					COP			ARE	ABU DHABI	ARE								1	130	130	13	3	-4.4	6	1	6	-1.96850393700787	4	Abu Dhabi, Abu Z¸aby, United Arab Emirates	AE	AE01	24.4667	54.3667	-782066	4	Abu Dhabi, Abu Z¸aby, United Arab Emirates	AE	AE01	24.4667	54.3667	-782066	4	Abu Dhabi, Abu Z¸aby, United Arab Emirates	AE	AE01	24.4667	54.3667	-782066	20181231	https://gulfnews.com/uae/weather/this-is-how-the-uae-weather-will-be-on-new-year-1.1546231222035
813290078	20181231	201812	2018	2018.9890	COP	POLICE						COP													1	130	130	13	3	-4.4	8	1	8	-0.51813471502591	4	Al Dhafra, Abu Z¸aby, United Arab Emirates	AE	AE01	23.4167	53.4167	-782073	0							4	Abu Dhabi, Abu Z¸aby, United Arab Emirates	AE	AE01	24.4667	54.3667	-782066	20181231	https://www.thenational.ae/uae/environment/uae-weather-warnings-for-a-foggy-new-year-1.807896
813290079	20181231	201812	2018	2018.9890	COP	POLICE						COP													1	130	130	13	3	-4.4	2	1	2	-0.51813471502591	4	Al Dhafra, Abu Z¸aby, United Arab Emirates	AE	AE01	23.4167	53.4167	-782073	0							4	Al Dhafra, Abu Z¸aby, United Arab Emirates	AE	AE01	23.4167	53.4167	-782073	20181231	https://www.thenational.ae/uae/environment/uae-weather-warnings-for-a-foggy-new-year-1.807896
813392602	20181231	201812	2018	2018.9890	IRN	IRAN	IRN								USA	THE US	USA								0	130	130	13	3	-4.4	5	1	5	-3.2719836400818	4	Gulf News, Dubayy, United Arab Emirates	AE	AE03	25.1877	55.2529	11414118	4	Gulf News, Dubayy, United Arab Emirates	AE	AE03	25.1877	55.2529	11414118	4	Gulf News, Dubayy, United Arab Emirates	AE	AE03	25.1877	55.2529	11414118	20181231	https://gulfnews.com/technology/companies/why-ai-holds-the-key-to-cyber-security-this-year-1.61091533
