775442017	20180729	201807	2018	2018.5726	GOV	MINISTRY						GOV			ARECVL	EMIRATI	ARE					CVL			1	130	130	13	3	-4.4	20	1	10	-3.42857142857143	4	Abu Dhabi, Abu Z¸aby, United Arab Emirates	AE	AE01	24.4667	54.3667	-782066	4	Abu Dhabi, Abu Z¸aby, United Arab Emirates	AE	AE01	24.4667	54.3667	-782066	4	Abu Dhabi, Abu Z¸aby, United Arab Emirates	AE	AE01	24.4667	54.3667	-782066	20180729	http://gulftoday.ae/portal/331d3a4e-7171-418a-85df-898171ddadd7.aspx
775464382	20180729	201807	2018	2018.5726											MDV	MALE	MDV								0	130	130	13	3	-4.4	5	1	5	-1.41474311243485	0							4	Dubai Municipality, Dubayy, United Arab Emirates	AE	AE03	25.2647	55.3118	11378495	4	Dubai Municipality, Dubayy, United Arab Emirates	AE	AE03	25.2647	55.3118	11378495	20180729	https://www.khaleejtimes.com/news/uae-health/80-success-rate-for-ivf-a-/myth-uae-experts
775464383	20180729	201807	2018	2018.5726											MDV	MALE	MDV								0	130	130	13	3	-4.4	1	1	1	-1.41474311243485	0							1	United Kingdom	UK	UK	54	-4	UK	4	Dubai, Dubayy, United Arab Emirates	AE	AE03	25.2522	55.28	-782831	20180729	https://www.khaleejtimes.com/news/uae-health/80-success-rate-for-ivf-a-/myth-uae-experts
775500714	20180729	201807	2018	2018.5726											BUS	BANK						BUS			1	130	130	13	3	-4.4	10	1	10	-3.55731225296442	0							4	Abu Dhabi, Abu Z¸aby, United Arab Emirates	AE	AE01	24.4667	54.3667	-782066	4	Abu Dhabi, Abu Z¸aby, United Arab Emirates	AE	AE01	24.4667	54.3667	-782066	20180729	https://gulfnews.com/news/uae/society/uae-warns-emirati-travellers-on-credit-card-fraud-abroad-1.2258384
775500805	20180729	201807	2018	2018.5726	AREMIL	UNITED ARAB EMIRATES	ARE					MIL			ARECOP	UNITED ARAB EMIRATES	ARE					COP			1	130	130	13	3	-4.4	1	1	1	-3.55731225296442	4	Abu Dhabi, Abu Z¸aby, United Arab Emirates	AE	AE01	24.4667	54.3667	-782066	4	Abu Dhabi, Abu Z¸aby, United Arab Emirates	AE	AE01	24.4667	54.3667	-782066	4	Abu Dhabi, Abu Z¸aby, United Arab Emirates	AE	AE01	24.4667	54.3667	-782066	20180729	https://gulfnews.com/news/uae/society/uae-warns-emirati-travellers-on-credit-card-fraud-abroad-1.2258384
775501291	20180729	201807	2018	2018.5726	MIL	COLONEL						MIL			ARECOP	ABU DHABI	ARE					COP			1	130	130	13	3	-4.4	7	1	7	-3.55731225296442	4	Abu Dhabi, Abu Z¸aby, United Arab Emirates	AE	AE01	24.4667	54.3667	-782066	4	Abu Dhabi, Abu Z¸aby, United Arab Emirates	AE	AE01	24.4667	54.3667	-782066	4	Abu Dhabi, Abu Z¸aby, United Arab Emirates	AE	AE01	24.4667	54.3667	-782066	20180729	https://gulfnews.com/news/uae/society/uae-warns-emirati-travellers-on-credit-card-fraud-abroad-1.2258384
